{
  "$schema": "http://json-schema.org/draft-04/schema#",
  "description": "",
  "type": "object",
  "properties": {
    "properties": {
      "type": "object",
      "properties": {
        "rootX": {
          "type": "number"
        },
        "rootY": {
          "type": "number"
        },
        "borderX": {
          "type": "number"
        },
        "borderY": {
          "type": "number"
        },
        "borderW": {
          "type": "number"
        },
        "borderH": {
          "type": "number"
        }
      },
      "required": [
        "rootX",
        "rootY",
        "borderX",
        "borderY",
        "borderW",
        "borderH"
      ]
    },
    "entities": {
      "type": "array"
    },
    "background": {
      "type": "array"
    },
    "foreground": {
      "type": "array"
    }
  },
  "required": [
    "properties",
    "entities",
    "background",
    "foreground"
  ]
}